{
  "$schema": "https://json-schema.org/draft/2020-12/schema",
  "$id": "https://prs.local/schemas/owner-windows-level2-acceptance-v0.1.json",
  "title": "PRS Owner Windows Level-2 Acceptance Evidence Bundle v0.1",
  "type": "object",
  "additionalProperties": false,
  "required": ["schema", "captured_at", "identity", "physical_owner_machine", "hosted_only", "scheduler_local_wake_exercised", "physical_power_loss_exercised", "gates", "negative_cases", "evidence_custody"],
  "properties": {
    "schema": {"const": "prs.owner-windows-level2-acceptance.v0.1"},
    "captured_at": {"type": "string", "minLength": 1},
    "identity": {
      "type": "object", "additionalProperties": false,
      "required": ["delivery_id", "request_id", "project_id", "mission_id", "task_id", "wake_trace_id", "host_id", "worker_id", "code_identity", "actor_id", "issuer", "config_identity"],
      "properties": {
        "delivery_id": {"type": "string", "minLength": 1}, "request_id": {"type": "string", "minLength": 1}, "project_id": {"type": "string", "minLength": 1}, "mission_id": {"type": "string", "minLength": 1}, "task_id": {"type": "string", "minLength": 1}, "wake_trace_id": {"type": "string", "minLength": 1}, "host_id": {"type": "string", "minLength": 1}, "worker_id": {"type": "string", "minLength": 1}, "code_identity": {"type": "string", "minLength": 1}, "actor_id": {"type": "string", "minLength": 1}, "issuer": {"type": "string", "minLength": 1}, "config_identity": {"type": "string", "minLength": 1}
      }
    },
    "physical_owner_machine": {"type": "boolean"}, "hosted_only": {"type": "boolean"}, "scheduler_local_wake_exercised": {"type": "boolean"}, "physical_power_loss_exercised": {"type": "boolean"},
    "gates": {
      "type": "object", "additionalProperties": false,
      "required": ["A", "B", "C", "D", "E", "F", "G", "H", "I", "J"],
      "properties": {"A": {"$ref": "#/$defs/gate"}, "B": {"$ref": "#/$defs/gate"}, "C": {"$ref": "#/$defs/gate"}, "D": {"$ref": "#/$defs/gate"}, "E": {"$ref": "#/$defs/gate"}, "F": {"$ref": "#/$defs/gate"}, "G": {"$ref": "#/$defs/gate"}, "H": {"$ref": "#/$defs/gate"}, "I": {"$ref": "#/$defs/gate"}, "J": {"$ref": "#/$defs/gate"}}
    },
    "negative_cases": {
      "type": "object", "additionalProperties": false,
      "required": ["1", "2", "3", "4", "5", "6", "7", "8", "9", "10", "11", "12", "13", "14", "15"],
      "properties": {"1": {"$ref": "#/$defs/negative"}, "2": {"$ref": "#/$defs/negative"}, "3": {"$ref": "#/$defs/negative"}, "4": {"$ref": "#/$defs/negative"}, "5": {"$ref": "#/$defs/negative"}, "6": {"$ref": "#/$defs/negative"}, "7": {"$ref": "#/$defs/negative"}, "8": {"$ref": "#/$defs/negative"}, "9": {"$ref": "#/$defs/negative"}, "10": {"$ref": "#/$defs/negative"}, "11": {"$ref": "#/$defs/negative"}, "12": {"$ref": "#/$defs/negative"}, "13": {"$ref": "#/$defs/negative"}, "14": {"$ref": "#/$defs/negative"}, "15": {"$ref": "#/$defs/negative"}}
    },
    "evidence_custody": {"type": "object", "additionalProperties": false, "required": ["outside_worker_path", "evidence"], "properties": {"outside_worker_path": {"type": "boolean"}, "evidence": {"$ref": "#/$defs/evidenceRefs"}}},
    "evidence_manifest": {
      "type": "object", "minProperties": 1,
      "additionalProperties": {"$ref": "#/$defs/evidenceManifestRecord"},
      "description": "Optional structurally for backward-readable FAIL/BLOCKED bundles, but required by the evaluator before PASS. Every referenced evidence ID must resolve here and bind to current code/config identity, capture time, independent custody, and at least one explicitly observed field from the canonical acceptance identity tuple."
    }
  },
  "$defs": {
    "evidenceRefs": {"type": "array", "minItems": 1, "uniqueItems": true, "items": {"type": "string", "minLength": 1}},
    "observedIdentity": {"type": "object", "minProperties": 1, "additionalProperties": false, "properties": {"delivery_id": {"type": "string", "minLength": 1}, "request_id": {"type": "string", "minLength": 1}, "project_id": {"type": "string", "minLength": 1}, "mission_id": {"type": "string", "minLength": 1}, "task_id": {"type": "string", "minLength": 1}, "wake_trace_id": {"type": "string", "minLength": 1}, "host_id": {"type": "string", "minLength": 1}, "worker_id": {"type": "string", "minLength": 1}, "code_identity": {"type": "string", "minLength": 1}, "actor_id": {"type": "string", "minLength": 1}, "issuer": {"type": "string", "minLength": 1}, "config_identity": {"type": "string", "minLength": 1}}},
    "evidenceManifestRecord": {"type": "object", "additionalProperties": false, "required": ["sha256", "source", "captured_by", "captured_at", "custody", "code_identity", "config_identity", "identity"], "properties": {"sha256": {"type": "string", "pattern": "^[A-Fa-f0-9]{64}$"}, "source": {"type": "string", "minLength": 1}, "captured_by": {"type": "string", "minLength": 1}, "captured_at": {"type": "string", "minLength": 1}, "custody": {"enum": ["independent", "worker"]}, "code_identity": {"type": "string", "minLength": 1}, "config_identity": {"type": "string", "minLength": 1}, "identity": {"$ref": "#/$defs/observedIdentity"}}},
    "gate": {"type": "object", "additionalProperties": false, "required": ["status", "evidence"], "properties": {"status": {"enum": ["pass", "fail", "not_exercised", "blocked"]}, "evidence": {"$ref": "#/$defs/evidenceRefs"}}},
    "negative": {"type": "object", "additionalProperties": false, "required": ["status", "evidence"], "properties": {"status": {"enum": ["pass", "fail", "not_exercised"]}, "evidence": {"$ref": "#/$defs/evidenceRefs"}}}
  }
}
