{
  "schema": "prs.owner-windows-level2-acceptance.v0.1",
  "captured_at": "2026-09-15T00:56:00+00:00",
  "identity": {
    "delivery_id": "not-yet-owner-machine-exercised",
    "request_id": "not-yet-owner-machine-exercised",
    "project_id": "agentos-local",
    "mission_id": "agentos-level2-owner-windows-acceptance",
    "task_id": "not-yet-owner-machine-exercised",
    "wake_trace_id": "not-yet-owner-machine-exercised",
    "host_id": "owner-physical-host-not-proven",
    "worker_id": "owner-physical-worker-not-proven",
    "code_identity": "4c8bcc3bc2ad2041b0a1871d3004c1db23f3c091",
    "actor_id": "owner-authenticated-actor-not-proven-end-to-end",
    "issuer": "canonical-issuer-not-proven-end-to-end",
    "config_identity": "owner-machine-config-not-captured"
  },
  "physical_owner_machine": false,
  "hosted_only": true,
  "scheduler_local_wake_exercised": false,
  "physical_power_loss_exercised": false,
  "gates": {
    "A": {"status": "not_exercised", "evidence": ["prs:hosted-and-repository-provenance-only"]},
    "B": {"status": "not_exercised", "evidence": ["prs:owner-physical-host-and-authenticated-transport-not-proven"]},
    "C": {"status": "fail", "evidence": ["prs:remote-admission-local-wake-contract-defect:4c8bcc3"]},
    "D": {"status": "not_exercised", "evidence": ["prs:real-owner-laptop-powershell-not-exercised"]},
    "E": {"status": "fail", "evidence": ["prs:continuous-project-file-ownership-defect:4c8bcc3"]},
    "F": {"status": "blocked", "evidence": ["prs:recovery-physical-acceptance-blocked-by-gate-e"]},
    "G": {"status": "blocked", "evidence": ["prs:physical-concurrency-acceptance-blocked-by-gate-e"]},
    "H": {"status": "not_exercised", "evidence": ["prs:owner-machine-durable-result-bundle-not-captured"]},
    "I": {"status": "blocked", "evidence": ["prs:green-ineligible-while-upstream-gates-fail"]},
    "J": {"status": "blocked", "evidence": ["prs:independent-physical-qualification-ineligible-while-upstream-gates-fail"]}
  },
  "negative_cases": {
    "1": {"status": "not_exercised", "evidence": ["prs:owner-machine-negative-case-not-run:1"]},
    "2": {"status": "not_exercised", "evidence": ["prs:owner-machine-negative-case-not-run:2"]},
    "3": {"status": "not_exercised", "evidence": ["prs:owner-machine-negative-case-not-run:3"]},
    "4": {"status": "not_exercised", "evidence": ["prs:owner-machine-negative-case-not-run:4"]},
    "5": {"status": "not_exercised", "evidence": ["prs:owner-machine-negative-case-not-run:5"]},
    "6": {"status": "not_exercised", "evidence": ["prs:owner-machine-negative-case-not-run:6"]},
    "7": {"status": "not_exercised", "evidence": ["prs:owner-machine-negative-case-not-run:7"]},
    "8": {"status": "not_exercised", "evidence": ["prs:owner-machine-negative-case-not-run:8"]},
    "9": {"status": "not_exercised", "evidence": ["prs:owner-machine-negative-case-not-run:9"]},
    "10": {"status": "fail", "evidence": ["prs:successor-displacement-reproduced:4c8bcc3"]},
    "11": {"status": "not_exercised", "evidence": ["prs:owner-machine-negative-case-not-run:11"]},
    "12": {"status": "not_exercised", "evidence": ["prs:owner-machine-negative-case-not-run:12"]},
    "13": {"status": "not_exercised", "evidence": ["prs:owner-machine-negative-case-not-run:13"]},
    "14": {"status": "pass", "evidence": ["prs:green-full-identity-negative-suite:offline-bridge-0.4"]},
    "15": {"status": "not_exercised", "evidence": ["prs:owner-machine-negative-case-not-run:15"]}
  },
  "evidence_custody": {
    "outside_worker_path": true,
    "evidence": ["prs:github-repository-and-actions-artifacts"]
  }
}
